<languages xmlns:xsi="http://www.w3.org/2001/XMLSchema-instance"
    xsi:noNamespaceSchemaLocation="./schemas/languages.xsd">

    <ja-JP>
        <name>日本語</name>
        <version>0.0.0</version>

        <contributors>
            <person name="Developer" />
        </contributors>
    </ja-JP>

    <en-US source="ja-JP">
        <name>English</name>
        <version>1.2.3</version>

        <contributors>
            <person name="OpenAI ChatGPT" type="ai" />
            <person name="Google Gemini" type="ai" />
            <person name="ETeyondLitle0721" email="eteyondlitle@gmail.com" />
        </contributors>
    </en-US>

    <zh-CN source="ja-JP">
        <name>简体中文</name>
        <version>1.1.4</version>

        <contributors>
            <person name="OpenAI ChatGPT" type="ai" />
            <person name="Google Gemini" type="ai" />
            <person name="ETeyondLitle0721" email="eteyondlitle@gmail.com" />
        </contributors>
    </zh-CN>

    <zh-TW source="ja-JP">
        <name>台灣正體</name>
        <version>1.2.3</version>

        <contributors>
            <person name="OpenAI ChatGPT" type="ai" />
            <person name="Google Gemini" type="ai" />
            <person name="ETeyondLitle0721" email="eteyondlitle@gmail.com" />
        </contributors>
    </zh-TW>

    <ko-KR source="ja-JP">
        <name>한국어</name>
        <version>1.0.3</version>

        <contributors>
            <person name="OpenAI ChatGPT" type="ai" />
            <person name="Google Gemini" type="ai" />
        </contributors>
    </ko-KR>
</languages>
